<?xml version="1.0"?>
<xsd:schema xmlns:xsd="http://www.w3.org/2001/XMLSchema">
	<xsd:element name="nom" type="xsd:string"/>
	<xsd:element name="service" type="xsd:string"/>
	<xsd:element name="personne">
		<xsd:complexType>
			<xsd:sequence>
				<xsd:element ref="nom"/>
				<xsd:element ref="service"/>
			</xsd:sequence>
		</xsd:complexType>
	</xsd:element>
	<xsd:element name="personnes">
		<xsd:complexType>
			<xsd:sequence>
				<xsd:element ref="personne" maxOccurs="unbounded"/>
			</xsd:sequence>
		</xsd:complexType>
	</xsd:element>
</xsd:schema>
